{
  "schema_version": "0.1",
  "task_id": "T027",
  "question": "How does RFCDC's conceptual account distinguish analytical from critical thinking, and what observable behaviours do its Advanced key descriptors specify for these skills?",
  "task_type": "cross_document_reasoning",
  "required_documents": [
    "DOC033",
    "DOC034"
  ],
  "reference_answer": "Volume 1 describes analytical thinking as systematically and logically analysing materials, including breaking them into elements and examining relationships, to reach defensible conclusions. Critical thinking evaluates materials and makes judgments, considering consistency with evidence, assumptions and purposes and using explicit criteria, principles or values. Volume 2's Advanced key descriptors for analytical and critical thinking specify identifying discrepancies, inconsistencies or divergences in analysed materials and using explicit, specifiable criteria, principles or values to make judgments. The conceptual distinction explains the kind of thinking; the descriptors express concrete proficiency-related behaviours rather than document identities or measured population attainment.",
  "reference_evidence": [
    {
      "document_id": "DOC033",
      "page": 48,
      "section": "Page 48",
      "chunk_id": "DOC033-P0048-C001"
    },
    {
      "document_id": "DOC033",
      "page": 49,
      "section": "Page 49",
      "chunk_id": "DOC033-P0049-C001"
    },
    {
      "document_id": "DOC034",
      "page": 21,
      "section": "Page 21",
      "chunk_id": "DOC034-P0021-C001"
    }
  ],
  "difficulty": "high",
  "notes": "Human verified on 2026-09-27 by explicit researcher approval APPROVE UC3 T021-T030; approved candidate in evidence/engineering/uc3_task_human_review_dossier_2026-09-27.md (SHA256 4376a5dcc36c1bb2f9590949cf71db32dc3faf5d6d6ea4cf0da887f91dc049be); human approval evidence: evidence/engineering/uc3_task_human_approval_2026-09-27.md.",
  "validation_status": "frozen"
}
